{"collector_version":"2.3.1","expires_at":"2026-08-27T00:00:00Z","min_supported_from_version":"2.0.0","not_before":"2026-07-28T00:00:00Z","platform":"linux/amd64","rollback":false,"schema_version":1,"sha256":"4ee662b3a4aaef43f636a0fe37c36be585d683f62678e8747ceca40c4393caf7","signature":"7gikHCblCqBg6tSY9RFfT57vbVqd35KMwKHuRpID2EZkV5egNWfgQGoeJKnCSgVEykq1jv6UXB2gHAvXn8FCDA==","signing_key_id":"56475aa75463474c","size_bytes":38}
